X.AUTHID,ILP1,ILP2,ILP3,MMR1,MMR2,MMR3
b'http://blog.searsholdings.com/leadership-viewpoint/pride-at-shc/',"SHC Speaks by As Chief HR Officer and co-e sponsor of Sears Holdings , I am honored to have volunteered at the 45 Annual Chicago Pride Parade .","This year, SHC partnered with , and to marry four couples on our float during the parade.",I was joined by dozens of SHC associates and family members who marched in the parade or cheered from the crowd.,"This year, SHC partnered with , and to marry four couples on our float during the parade.",I was joined by dozens of SHC associates and family members who marched in the parade or cheered from the crowd.,"SHC Speaks by As Chief HR Officer and co-e sponsor of Sears Holdings , I am honored to have volunteered at the 45 Annual Chicago Pride Parade ."
b'https://atyourservice.blogs.xerox.com/category/support-tools/page/6/',When you look at your Xerox device and see the incorrect date and time; that could be the reason Picture it You are having a perfectly calm and uneventful day and then it happens fault code on the Xerox printer!,Recently new support videos were posted to the Xerox Channel on YouTube.,Xerox and Xerox and Design are trademarks of Xerox Corporation in the United States and/or other countries.,Xerox and Xerox and Design are trademarks of Xerox Corporation in the United States and/or other countries.,Recently new support videos were posted to the Xerox Channel on YouTube.,All rights reserved.
b'http://blogs.zebra.com/whitepaper-label'," ; March 17, 2015 at 8:03 AM ;Product identification labels are now viewed as a as a critical mechanism for maintaining compliance, ensuring brand consistency, improving operational efficiency, and supporting business growth.","It is critical that the labels you utilize are not only readable and scannable when they leave your operation, but throughout the products safe and appropriate use and disposal.",";In this paper, Zebra provides guidance on how to select the optimal material to identify your product by reviewing thermal printing basics, identifying the key considerations you need to be mindful of and what to look for in a supplier.","It is critical that the labels you utilize are not only readable and scannable when they leave your operation, but throughout the products safe and appropriate use and disposal.",";In this paper, Zebra provides guidance on how to select the optimal material to identify your product by reviewing thermal printing basics, identifying the key considerations you need to be mindful of and what to look for in a supplier.",This will reduce your risk of non-compliance to government and industry mandates.
b'https://connect.blogs.xerox.com/author/laurie-riedman/page/2/',Writer and PR Consultant Email LinkedIn Twitter Laurie Riedman is a geek at heart and loves working with Xerox scientists around the globe.,"By By Laurie Riedman, PR Consultant Throughout the year I work with some of the smartest minds at Xerox the scientists and researchers hard at work in By By Laurie Riedman, consultant, Xerox Public Relations Over the past few months there have been many conversations about Xerox and PARC, a Xerox Company, and Xerox role By by, Laurie Riedman, PR Consultant, Innovation Blogger Questions.",Xerox and Xerox and Design are trademarks of Xerox Corporation in the United States and/or other countries.,"By By Laurie Riedman, PR Consultant Throughout the year I work with some of the smartest minds at Xerox the scientists and researchers hard at work in By By Laurie Riedman, consultant, Xerox Public Relations Over the past few months there have been many conversations about Xerox and PARC, a Xerox Company, and Xerox role By by, Laurie Riedman, PR Consultant, Innovation Blogger Questions.",Remembering how when my children were young it was through those endless questions Select list(s): Facebook Twitter Google +1 LinkedIn Youtube Select list(s): 2017 Xerox Corporation.,I was thinking about them today.
b'http://blog.searsholdings.com/2016/07/page/2/',"For our Danbury Sears store, this meant that we would continue to serve the community, but with a smaller footprint.","On Saturday, July 2, Sears celebrated the grand re-opening of our Danbury store which showcased a new smaller store layout assorted to better serve the needs of our members and improve our in-store shopping e by I recently had the privilege of sharing with associates that I proud to work for a company that isn't afraid to transform.","With the pride that I have for Sears Holdings, focusing on my best comes naturally, whether that in building relationships with those who I work with, helping our members or e our company transformation to my family and friends by This week the Veterans of Foreign Wars (VFW) facility in Denver, Colorado, Lowry Post 501, received critical repairs and improvements thanks to the Sears Heroes at Home program and Rebuilding Together.","For our Danbury Sears store, this meant that we would continue to serve the community, but with a smaller footprint.","With the pride that I have for Sears Holdings, focusing on my best comes naturally, whether that in building relationships with those who I work with, helping our members or e our company transformation to my family and friends by This week the Veterans of Foreign Wars (VFW) facility in Denver, Colorado, Lowry Post 501, received critical repairs and improvements thanks to the Sears Heroes at Home program and Rebuilding Together.","SHC Speaks by As the retail landscape continues to change, we are making changes of our own."
b'http://blog.searsholdings.com/leena-munjal/from-a-loyal-member-what-sears-means-to-me/',Our transformation is focused on serving our members to give them a robust choice of products and services.,"After the story aired, I received a beautiful, heartfelt, kind letter from a loyal member that I like to showcase on this blog.",Because who better to tell our story than our members and customers.,Because who better to tell our story than our members and customers.,Our transformation is focused on serving our members to give them a robust choice of products and services.,"As I said in the NPR story, we are facing the same challenges as many of our competitors."
b'https://atyourservice.blogs.xerox.com/category/uncategorized/',"This Sunday March 12, 2017 is the day we lose an hour of sleep to The Xerox PrintSafe Software was recently upgraded.",If you Do you know the serial number of your Xerox Printer or Multifunction device?,Xerox and Xerox and Design are trademarks of Xerox Corporation in the United States and/or other countries.,Xerox and Xerox and Design are trademarks of Xerox Corporation in the United States and/or other countries.,"not Kansas, we are living Several new Xerox VersaLink printers and multifunction printers (MFP) have been introduced lately, specifically the VersaLink C7000-7020-25-30 and VersaLink B7025-35 and the VersaLink C500-C505-C600-C605.", My homage to Dorothy.
b'https://channelpartner.blogs.xerox.com/author/julian-patel/page/5/',General Manager Volume Supplies & Operations Developing Markets Email LinkedIn Twitter Julian is the General Manager for Volume Supplies & Operations for Xerox Developing Markets.,Julian focus is to support all channel partners to profitably grow and ensure Xerox are delivering the tools and strategies to support them in a manner than fits their business model.,Xerox and Xerox and Design are trademarks of Xerox Corporation in the United States and/or other countries.,Julian focus is to support all channel partners to profitably grow and ensure Xerox are delivering the tools and strategies to support them in a manner than fits their business model.,Select list(s): Franchise Nagpur says: Andy Hill says: Larry Levine says: Facebook Twitter LinkedIn Youtube Select list(s): 2017 Xerox Corporation.,"As online research replaces face-to-face interaction, relationships with sales and marketing people are being sidestepped."
b'https://digitalprinting.blogs.xerox.com/author/gtesta/',"Email By Mailing Industry, an e at the Smithsonian National Postal Museum, showcases the many contributions Xerox has made to postal services in the United States.",By Automation has a growing role in your customers marketing programs.,Xerox and Xerox and Design are trademarks of Xerox Corporation in the United States and/or other countries.,Xerox and Xerox and Design are trademarks of Xerox Corporation in the United States and/or other countries.,By Automation has a growing role in your customers marketing programs.,Continue reading to learn how.
b'https://atyourservice.blogs.xerox.com/page/2/',"Today I am sharing with you a blog article from the Xerox blog, Xerox Connect.",The article is one in a series of Modern Workplace articles My homage to Dorothy.,Xerox and Xerox and Design are trademarks of Xerox Corporation in the United States and/or other countries.,"Today I am sharing with you a blog article from the Xerox blog, Xerox Connect.",We have a great one for you.,"not Kansas, we are living Several new Xerox VersaLink printers and multifunction printers (MFP) have been introduced lately, specifically the VersaLink C7000-7020-25-30 and VersaLink B7025-35 and the VersaLink C500-C505-C600-C605."
b'https://atyourservice.blogs.xerox.com/author/cherylo23/page/2/',"Email By Today I am sharing with you a blog article from the Xerox blog, Xerox Connect.",The article is one in a series of Modern Workplace articles By My homage to Dorothy.,Xerox and Xerox and Design are trademarks of Xerox Corporation in the United States and/or other countries.,"Email By Today I am sharing with you a blog article from the Xerox blog, Xerox Connect.",We have a great one for you.,"not Kansas, we are living By Several new Xerox VersaLink printers and multifunction printers (MFP) have been introduced lately, specifically the VersaLink C7000-7020-25-30 and VersaLink B7025-35 and the VersaLink C500-C505-C600-C605."
b'https://atyourservice.blogs.xerox.com/category/printing/page/5/',"XMPie features the ability to create personalized marketing campaigns across several channels print, Web, email, We are revisiting AirPrint because of the release of a new video that will walk you through the simple steps to enable AirPrint on your Xerox Happy New Year!","New Year, New Start!",I always feel like the New Year is a new beginning.,"XMPie features the ability to create personalized marketing campaigns across several channels print, Web, email, We are revisiting AirPrint because of the release of a new video that will walk you through the simple steps to enable AirPrint on your Xerox Happy New Year!",Did you know that you can store print jobs on your printer or multifunction device to be Image quality issues can be caused by different things.,All rights reserved.
b'https://blog.fitbit.com/sitting-hurts-fitbit-data-suggests-you-should-move-more-often/',; Comments numbers are pretty sad for the U.S.;Is there any way those of us with different Fitbit models can set up an alarm like the Alta?,;Good article I have a fitbit charge hr and set the alarm to tell me to move.,the chart looks terrible;Is there a way to see how many hours a day you sit with the fitbit data output?,; Comments numbers are pretty sad for the U.S.;Is there any way those of us with different Fitbit models can set up an alarm like the Alta?,the chart looks terrible;Is there a way to see how many hours a day you sit with the fitbit data output?,A buzz for the hours when I havent reached the 250 steps at say the 45 min mark would be great reminder and help get me in the habit.
b'https://atyourservice.blogs.xerox.com/category/features/page/6/', There are some new printers in town.,These printers are the Xerox VersaLink C400 Printer and the VersaLink B400 Printer.,VersaLink C400 is a color What old is new again.,These printers are the Xerox VersaLink C400 Printer and the VersaLink B400 Printer.,"Some 40 years ago Brother Dominic performed the miracle of copying a multiple page document, returning 500 sets of the document Let look at the Xerox ConnectKey for SharePoint.",All rights reserved.
b'https://atyourservice.blogs.xerox.com/category/support-tools/page/4/',With Xerox Remote Print Services you can manage your Xerox printers with minimal How would you like your Xerox support?,Did you Have questions about how to use the Xerox Standard Accounting (XSA) with your Xerox printer or multifunction printer with your Apple Mac?,Xerox and Xerox and Design are trademarks of Xerox Corporation in the United States and/or other countries.,With Xerox Remote Print Services you can manage your Xerox printers with minimal How would you like your Xerox support?,Make sure you have This doesn seem like the correct charge for my Xerox device usage that meter read is not even close.,Sound familiar?
b'https://atyourservice.blogs.xerox.com/category/general-information/page/5/',Xerox has been committed to sustainability and Spend more time on your work and less time managing your Xerox devices.,With Xerox Remote Print Services you can manage your Xerox printers with minimal This doesn seem like the correct charge for my Xerox device usage; that meter read is not even close.,Xerox and Xerox and Design are trademarks of Xerox Corporation in the United States and/or other countries.,With Xerox Remote Print Services you can manage your Xerox printers with minimal This doesn seem like the correct charge for my Xerox device usage; that meter read is not even close.,"As we have said for years, every day is Earth Day at Xerox.","It that time again, time to Spring forward on the clocks."
b'https://atyourservice.blogs.xerox.com/page/9/',Xerox has been committed to sustainability and Stop the presses!,With Xerox Remote Print Services you can manage your Xerox printers with minimal How would you like your Xerox support?,Xerox and Xerox and Design are trademarks of Xerox Corporation in the United States and/or other countries.,With Xerox Remote Print Services you can manage your Xerox printers with minimal How would you like your Xerox support?,"As we have said for years, every day is Earth Day at Xerox.",The new Versant Presses are here!
b'https://atyourservice.blogs.xerox.com/category/support-tools/page/7/',Yes your Xerox printer or multifunction device Happy New Year!,"New Year, New Start!",I always feel like the New Year is a new beginning.,Yes your Xerox printer or multifunction device Happy New Year!,I have firmware?,I always feel like the New Year is a new beginning.
b'https://connect.blogs.xerox.com/author/laurie-riedman/',Xerox data scientists consider algorithms that can prevent biased analytics.,By sessions with our customers help Xerox transform into a services company.,Xerox and Xerox and Design are trademarks of Xerox Corporation in the United States and/or other countries.,Xerox and Xerox and Design are trademarks of Xerox Corporation in the United States and/or other countries.,Xerox data scientists consider algorithms that can prevent biased analytics.,All rights reserved.
b'https://enterprisematters.blogs.xerox.com/author/guestcontributor/page/4/',"time complaining about consumerization and how managing employee-owned devices is such a huge By With the glut of marketing data available, it easy to understand why decision makers feel overwhelmed and too time-constrained to e the most effective method(s) of By Todd Smith, Xerox Corp. Can you imagine a world and workplace without smartphones?","CIO.com posted a slideshow about eight business and consumer By By Don Di, senior vice president, Global Document Outsourcing, Xerox There no question the workplace is changing in fact, it not really a place at all Select list(s): Leslie Long says: Christina G Bolin says: Christina G Bolin says: Facebook Twitter Google +1 LinkedIn Youtube Select list(s): 2017 Xerox Corporation.",Xerox and Xerox and Design are trademarks of Xerox Corporation in the United States and/or other countries.,Xerox and Xerox and Design are trademarks of Xerox Corporation in the United States and/or other countries.,"But I always tried to maintain at least a modest baseline-knowledge of SEO best-practices because I By Consumerization of IT is here in full force, and it not going away.",How about keyboards and mice?
b'https://www.citrix.com/blogs/2017/05/17/citrix-cloud-at-synergy-dont-take-my-word-for-it/',"Ill be hosting a unique set of customersat ;, SYN109, (Wednesday May 24, 4:45pm) where well have a discussion and audience-driven Q&A with 4 Citrix Cloud customers:;Well cut the marketing fluff.","Just candid, matter-of-fact discussions about:;Ken is Sr. Director of Product Marketing in Citrix's Cloud Services group, and spends most of his time helping lead the charge to converge concepts of cloud computing, virtual workspaces, and hosted service providers.","One of the key differentiators ; Citrix VP of WW Sales and Strategy, Ash Vijayakanthan shares his thoughts on the benefits Citrix Cloud brings for Citrix Service Providers ; NetScaler Management and Analytics from Citrix allows administrators to easily view, automate, and manage all their application infrastructure, as well ;Dont worry, you can unsubscribe at anytime.","Just candid, matter-of-fact discussions about:;Ken is Sr. Director of Product Marketing in Citrix's Cloud Services group, and spends most of his time helping lead the charge to converge concepts of cloud computing, virtual workspaces, and hosted service providers.","Ill be hosting a unique set of customersat ;, SYN109, (Wednesday May 24, 4:45pm) where well have a discussion and audience-driven Q&A with 4 Citrix Cloud customers:;Well cut the marketing fluff.",Join me!
b'https://atyourservice.blogs.xerox.com/author/gigi-zakhary/',With Xerox By Spend more time on your work and less time managing your Xerox devices.,With Xerox Remote Print Services you can manage your Xerox printers with minimal By This doesn seem like the correct charge for my Xerox device usage; that meter read is not even close.,Xerox and Xerox and Design are trademarks of Xerox Corporation in the United States and/or other countries.,With Xerox By Spend more time on your work and less time managing your Xerox devices.,With Xerox Remote Print Services you can manage your Xerox printers with minimal By This doesn seem like the correct charge for my Xerox device usage; that meter read is not even close.,Sound familiar?
b'https://smallbusinesssolutions.blogs.xerox.com/author/icbgguestblogger/page/2/',"Email By In a Small Business Solutions article published earlier this year ( Business New Year Resolution: Don Stop Emailing), I argued that email solicitations should remain an By If you like me, the term advertising is somewhat new to you.",That true in our personal lives as well as in business.,"But as any successful small-business owner will attest, improving By The Phaser 7100 Color Printer has been awarded the Choice designation by PC Magazine.","Email By In a Small Business Solutions article published earlier this year ( Business New Year Resolution: Don Stop Emailing), I argued that email solicitations should remain an By If you like me, the term advertising is somewhat new to you.",Xerox and Xerox and Design are trademarks of Xerox Corporation in the United States and/or other countries.,"Overall, the review is very positive."
b'https://enterprisematters.blogs.xerox.com/category/mobile-workforce/page/5/', Sometimes we talk about mobile workers as if they were a subset of the overall employee population.,"The e suite and the legal team Supporting mobile workers is no longer an option, but it can still be a burden one that falls squarely on IT shoulders.","Enterprise IT managers By Dan Stark, Offering Manager, Mobile Print, Xerox Corp. As enterprises face an increasingly mobile workforce, they struggle to adapt legacy document workflow to a mobile document Select list(s): Leslie Long says: Christina G Bolin says: Christina G Bolin says: Facebook Twitter Google +1 LinkedIn Youtube Select list(s): 2017 Xerox Corporation.","Enterprise IT managers By Dan Stark, Offering Manager, Mobile Print, Xerox Corp. As enterprises face an increasingly mobile workforce, they struggle to adapt legacy document workflow to a mobile document Select list(s): Leslie Long says: Christina G Bolin says: Christina G Bolin says: Facebook Twitter Google +1 LinkedIn Youtube Select list(s): 2017 Xerox Corporation.","Actually it more likely the other way around, with Every day brings a new statistic on how many workers don work in an office anymore.",All rights reserved.
b'http://global-sei.com/company/press/2016/08/prs064.html',"Press Release; August 2, 2016 ;Sumitomo Electric Industries, Ltd.; ;The Japan Regional Quality Award (Electric Category) is the motor company's top award praising the quality of products delivered in the domestic electric category.","President of Sumitomo Electric Masayoshi Matsumoto attended the 2016 Nissan Global Award ceremony, held on July 12, where a certification of commendation and trophy were presented by E Vice President of Nissan Kimiyasu Nakamura.",";Left: Mr. Kimiyasu Nakamura, E Vice President of Nissan; and right: Masayoshi Matsumoto, President of Sumitomo Electric;Certificate of commendation","President of Sumitomo Electric Masayoshi Matsumoto attended the 2016 Nissan Global Award ceremony, held on July 12, where a certification of commendation and trophy were presented by E Vice President of Nissan Kimiyasu Nakamura.","Press Release; August 2, 2016 ;Sumitomo Electric Industries, Ltd.; ;The Japan Regional Quality Award (Electric Category) is the motor company's top award praising the quality of products delivered in the domestic electric category.",";Further encouraged by our receiving this award in recognition of our contribution to the Japanese market, we would like to strive to achieve the ne target - to win the global quality award."
b'https://enterprisematters.blogs.xerox.com/category/document-workflow/page/3/',"Today that job Guest post by Edd Nicklin, Director, Tipac, Ltd.",This post originally appeared on the Tipac blog.,Xerox and Xerox and Design are trademarks of Xerox Corporation in the United States and/or other countries.,"Today that job Guest post by Edd Nicklin, Director, Tipac, Ltd.",We say it Select list(s): Leslie Long says: Christina G Bolin says: Christina G Bolin says: Facebook Twitter Google +1 LinkedIn Youtube Select list(s): 2017 Xerox Corporation., One definition of a mobile worker describes someone who spends time in more than one place or travels as part of the assignment.
b'https://smallbusinesssolutions.blogs.xerox.com/category/information-security/page/5/',"A CDW study published in October 2012 finds that, businesses get a competitive lift from their employees use of mobile devices and that employees mostly deliver For small business owners, getting to a point where it very difficult to ignore technology, said analyst Laurie McCabe, co-founder and partner of the SMB Paul Criswell, Product Marketing ManagerXerox Indirect Channels Business GroupIT departments, big and small, are challenged every day on multiple fronts.",They wear a number of different Select list(s): pius sumba says: TPM Best Practices says: azimmer says: Facebook Twitter LinkedIn Youtube Select list(s): 2017 Xerox Corporation.,Xerox and Xerox and Design are trademarks of Xerox Corporation in the United States and/or other countries.,Xerox and Xerox and Design are trademarks of Xerox Corporation in the United States and/or other countries.," Last week was the 50th installment of National Small Business Week, and companies and organizations far and wide took to media to celebrate the successes and We all heard the news stories about massive data breaches that result in personal information being stolen from tens, even hundreds of thousands of customer accounts.",All rights reserved.
b'https://smallbusinesssolutions.blogs.xerox.com/category/uncategorized/page/3/'," The Xerox Wireless Print Solutions Adapter seamlessly connects your Xerox printer or MFP to modern mobile and desktop workflows, regardless of your office environment.","But unfortunately for small-business owners, there has yet to As the pace of business continues to accelerate, people need tools to ma productivity and keep costs in check.",Xerox and Xerox and Design are trademarks of Xerox Corporation in the United States and/or other countries.,Xerox and Xerox and Design are trademarks of Xerox Corporation in the United States and/or other countries.,"But unfortunately for small-business owners, there has yet to As the pace of business continues to accelerate, people need tools to ma productivity and keep costs in check.",Imagine you on a tight deadline and others are depending on you.
b'http://blogs.zebra.com/save-the-date-zebra-hosts-talkiot-twitter-chat-on-10/15',"Its simple just log onto Twitter from 3:15 pm to 4:15 pm CT on Wednesday, October 15; and search #TalkIoT!",";A Twitter Chat is a live discussion that takes place on Twitter, powered by a consistently used hashtag.","Hashtags are a crowd-sourced solution to organize conversations on Twitter around a specific term with a pound sign in front of it (ex: #IoTChat, #RFIDchat).",";A Twitter Chat is a live discussion that takes place on Twitter, powered by a consistently used hashtag."," ; October 13, 2014 at 12:04 PM ;You may have heard by now that Philip Gerskovich, snior vice president, new growth platforms at Zebra, will be returning to the Internet of Things World Forum (IoTWF) stage to deliver part two of his 2013 keynote;The Internet of Things: How It Will Inspire Enterprises to Transform Customer E. ;Please join us to build on what Gerskovich discusses with IoTWF attendees along with those who werent able to be there live.","Hashtags are a crowd-sourced solution to organize conversations on Twitter around a specific term with a pound sign in front of it (ex: #IoTChat, #RFIDchat)."
