X.AUTHID,ILP1,ILP2,ILP3,MMR1,MMR2,MMR3
b'https://www.citrix.com/blogs/2017/09/01/provisioning-xendesktop-on-azure-just-got-a-lot-faster/',"After creating the machine, the machine is running and there is no other option as Azure assumes that the machine was created because it was needed for some immediate purpose.","There is no Azure compute charge for machines in this state so it stands to reason that the machines do not e. When we stopped the machine immediately after Azure had allocated it, Azure deallocated the machine to avoid compute charges to the subscription.",;This means that that the time it takes to start an e machine is comparable to creating a new machine.,"After creating the machine, the machine is running and there is no other option as Azure assumes that the machine was created because it was needed for some immediate purpose.",;This means that that the time it takes to start an e machine is comparable to creating a new machine.,"There is no Azure compute charge for machines in this state so it stands to reason that the machines do not e. When we stopped the machine immediately after Azure had allocated it, Azure deallocated the machine to avoid compute charges to the subscription."
b'https://digitalprinting.blogs.xerox.com/2015/10/26/does-my-business-really-need-a-blog/',But do printers need a blog?,Do you read printers blogs?,"is that a good, regularly updated blog with specific, relevant content can really help you.",But do printers need a blog?,"is that a good, regularly updated blog with specific, relevant content can really help you.","If you have a blog, they take a look."
b'https://enterprisematters.blogs.xerox.com/2017/08/09/xerox-scanners-a-better-way-to-pick-paper/',"Businesses must now find solutions to digitize documents as soon as they come into an office workflow, and it all begins with a scan.","By unlocking the data trapped on paper, an organization can streamline workflows, resulting in enhanced productivity and a stronger bottom line.",Businesses benefit when they digitize documents as soon as they enter office workflow.,"Businesses must now find solutions to digitize documents as soon as they come into an office workflow, and it all begins with a scan.","By unlocking the data trapped on paper, an organization can streamline workflows, resulting in enhanced productivity and a stronger bottom line.",Scanning and capture technology continues to be key in the digital journey and investing in the best hardware and software will set your business up for success.
b'http://newsroom.lufthansagroup.com/english/news/all/of-marriage-proposals-and-shitstorms/s/980eafb4-4086-4a1c-b611-16297d3c798e',"Our colleagues in Cape Town and Berlin who monitor the social media channels; hence, carry out research for their responses, patiently answer service requests regarding luggage and rebookings and politely respond to sometimes emotionally charged complaints.",";: The social media team at Lufthansa in Touch monitors all comments and answers questions that are asked on Facebook, Twitter, Google+ and Instagram.",";Lufthansa in Touch manages the following social media channels:;Facebook;Twitter;Google+;YouTube;Instagram;Tracking down aircraft;Pinterest is female;Eclipse flight to Munich, Germany - footage;of;MORE INFO;DOWNLOAD;Media Cart;MORE INFO;DOWNLOAD;Media Cart;SHARE;MORE INFO;DOWNLOAD;Media Cart;MORE INFO;DOWNLOAD;Media Cart;SHARE;ID:;ID:; (All Fields Required) ;You must complete additional steps or remove assets to resume downloading.",";: The social media team at Lufthansa in Touch monitors all comments and answers questions that are asked on Facebook, Twitter, Google+ and Instagram.","Our colleagues in Cape Town and Berlin who monitor the social media channels; hence, carry out research for their responses, patiently answer service requests regarding luggage and rebookings and politely respond to sometimes emotionally charged complaints.",";Lufthansa in Touch manages the following social media channels:;Facebook;Twitter;Google+;YouTube;Instagram;Tracking down aircraft;Pinterest is female;Eclipse flight to Munich, Germany - footage;of;MORE INFO;DOWNLOAD;Media Cart;MORE INFO;DOWNLOAD;Media Cart;SHARE;MORE INFO;DOWNLOAD;Media Cart;MORE INFO;DOWNLOAD;Media Cart;SHARE;ID:;ID:; (All Fields Required) ;You must complete additional steps or remove assets to resume downloading."
b'http://blog.searsholdings.com/shc-updates/making-significant-progress-toward-our-transformation-and-returning-to-profitability/',"SHC Speaks by (pdf) As rapid changes and headwinds continue across the retail industry, we, at Sears Holdings, remain dedicated to building a member-centric retail offering that delivers convenience and value through our integrated store and online e. Since the beginning of the year, we have been working with resolve to accelerate our transformation and achieve profitability .","Not only will Sears Holdings continue to offer Craftsman-branded products in its stores and online platforms, but we are also unlocking significant value from the brand through a $525 million cash payment at closing and annual payments of between 2.5% and 3.5% on new Stanley Black & Decker sales of Craftsman products for the ne 15 years.","All of our associates at Sears Holdings are committed to delivering convenience and value for our customers through our Shop Your Way membership program and our integrated store and online e. We will continue to innovate, improve our efficiency, enhance our financial fle, broaden the reach of our brands and services and work toward our transformation more broadly in order to ensure our competitiveness in the future of retail.","Not only will Sears Holdings continue to offer Craftsman-branded products in its stores and online platforms, but we are also unlocking significant value from the brand through a $525 million cash payment at closing and annual payments of between 2.5% and 3.5% on new Stanley Black & Decker sales of Craftsman products for the ne 15 years.","All of our associates at Sears Holdings are committed to delivering convenience and value for our customers through our Shop Your Way membership program and our integrated store and online e. We will continue to innovate, improve our efficiency, enhance our financial fle, broaden the reach of our brands and services and work toward our transformation more broadly in order to ensure our competitiveness in the future of retail.",Members can also schedule appointments with in-store e using the on our Sears website.
b'https://channelpartner.blogs.xerox.com/2015/07/27/5-ways-to-future-proof-and-grow-your-business/',Future-proof & grow your business: 5 ways for channel partners Building a strong client relationship will help you become a trusted business partner that adds value.,Future-proofing your business - five tactics for channel partners Future-proofing your business in this way means you be able to answer my opening question with a lot more confidence.,So where will your business be in 5 years time?,Future-proof & grow your business: 5 ways for channel partners Building a strong client relationship will help you become a trusted business partner that adds value.,So where will your business be in 5 years time?,"However, finding ways to anticipate what the future may bring and planning accordingly goes a long way towards achieving both our business and personal goals."
b'https://digitalprinting.blogs.xerox.com/2015/05/05/why-you-should-fire-a-customer-today/',This printer had a customer who had rejected a poster that had been produced.,So the customer rejected it again.,The printer spoke to me because he didn know what else he could do for the customer.,This printer had a customer who had rejected a poster that had been produced.,The printer spoke to me because he didn know what else he could do for the customer.,He knew that the customer would keep on rejecting it until he had an e colour match.
b'https://www.blackstone.com/media/blogs/article/blackstone-s-michael-chae-reflects-on-first-18-months-as-cfo',"What happened in August of 2015, and its effect on the markets overall affected how the REIT market traded in the fall of 2015 that, I think, created the conditions for our Real Estate business to do a couple of really big deals, taking private BioMed, taking private Strategic Hotels, that was like $15 billion in aggregate and within the subsequent 12, 14 months, we substantially e our Strategic Hotels deal in a quick period of time, and the BioMed deal is going really well.","There is a $35-or-so trillion global pension market, something like over $10 billion of U.S. retail assets that we consider long-term addressable for us.","Please click on the link ""Learn More"" below if you would like more information about the cookies used on this website and how to select certain cookies.","What happened in August of 2015, and its effect on the markets overall affected how the REIT market traded in the fall of 2015 that, I think, created the conditions for our Real Estate business to do a couple of really big deals, taking private BioMed, taking private Strategic Hotels, that was like $15 billion in aggregate and within the subsequent 12, 14 months, we substantially e our Strategic Hotels deal in a quick period of time, and the BioMed deal is going really well.","Please click on the link ""Learn More"" below if you would like more information about the cookies used on this website and how to select certain cookies.","So, again, a lot of opportunity there, and we set up a number of these deals and priced them in the first and second quarter at a time of great distress, and closed them later in the year."
b'https://enterprisematters.blogs.xerox.com/2013/01/04/reasons-to-pay-attention-to-mobile-print-in-2013/',"Now, there are solutions that make it easier than before by printing from your mobile device to any printer wherever you are.","With that much information being processed on mobile devices, other desktop-centric capabilities like print will naturally be required for people to be able to accomplish their jobs.","You can take all your documents in a mobile device, but if you are in a meeting or even looking for a new job, you probably face situations where a printing is needed.","With that much information being processed on mobile devices, other desktop-centric capabilities like print will naturally be required for people to be able to accomplish their jobs.","Now, there are solutions that make it easier than before by printing from your mobile device to any printer wherever you are.",Good article Breanna a heard another stat recently that supports this idea of common work processes moving from desktop to mobile devices.
b'https://digitalprinting.blogs.xerox.com/2015/07/01/how-to-create-an-elevator-pitch-that-wins-new-business/',An elevator pitch is the sales introduction you would use if you met someone in a lift.,So what makes a good elevator pitch?,The first step in an elevator pitch is to state that you work with companies like your prospect.,The first step in an elevator pitch is to state that you work with companies like your prospect.,An elevator pitch is the sales introduction you would use if you met someone in a lift.,So what makes a good elevator pitch?
b'https://www.blackstone.com/media/blogs/article/-rare-air-a-discussion-with-blackstone-s-eric-mcalpine-on-tech-valuations',What are perhaps harder to understand are the private market valuations for companies with less than $100M in revenue and not a lot of longevity.,I think what youre seeing is the market is already rewarding companies that are hugely disruptive with scale and high growth.,These are all companies being valued very highly in the private markets.,What are perhaps harder to understand are the private market valuations for companies with less than $100M in revenue and not a lot of longevity.,These are all companies being valued very highly in the private markets.,Investors get comfortable with the valuations by doing a forward projection of how profitable these companies may be at scale think $500M or $1B in annual revenue or more.
b'http://newsroom.lufthansagroup.com/english/more/innovation-technology/the-lufthansa-group-invests-in-customization-and-digitalization/s/f2e53d53-317e-43b1-ab86-8c7a0427bee1',"To support this, the Lufthansa Group is making major investments in the areas of product customization and digitalization.",";Between now and 2020, the Lufthansa Group will be investing 500 million euros in the new development and improvement of personalized digital offers alone.",Whether above the clouds or on the ground the Lufthansa Group is reacting to customer preferences with tailor-made digital offers.,Whether above the clouds or on the ground the Lufthansa Group is reacting to customer preferences with tailor-made digital offers.,";Between now and 2020, the Lufthansa Group will be investing 500 million euros in the new development and improvement of personalized digital offers alone.","Heike Birlenbach, Senior Vice President Sales Hub Airlines Lufthansa Group, emphasizes: Standardized processes across all three hub airlines and shared structures reduce comple and make our customers and sales partners the central focus of everything we do."
b'https://channelpartner.blogs.xerox.com/2015/07/13/how-to-know-when-you-are-ready-to-go-exclusive-with-one-vendor/',The curriculum provided keeps The MPS Group technicians up to speed on all the new products while teaching them the technology as if they were one of Xerox own technicians.,The most important attribute when choosing a vendor is _ says The MPS Group Reliability is the one single quality Xerox leads with that made James choose an e partnership.,"The MPS Group is 100% confident in Xerox service and products as James says, other company has been able to match the proven the service and reliability we require.",The most important attribute when choosing a vendor is _ says The MPS Group Reliability is the one single quality Xerox leads with that made James choose an e partnership.,"previously tested the vendor waters in terms of variety amongst their products and services, but why are they continuing to stay e with Xerox?",The curriculum provided keeps The MPS Group technicians up to speed on all the new products while teaching them the technology as if they were one of Xerox own technicians.
b'http://www.wholefoodsmarket.com/blog/50-reasons-love-butternut-squash',Another go-to for both butternut squash novices and those with e is this recipe for .,Butternut squash can also add richness to whole wheat rolls as seen in these Have leftover cooked butternut squash?,"And if you looking to start your day with veggies, butternut squash is a smart smoothie addition (try subbing roasted butternut squash in for the sweet potato in our recipe.",Butternut squash can also add richness to whole wheat rolls as seen in these Have leftover cooked butternut squash?,"And if you looking to start your day with veggies, butternut squash is a smart smoothie addition (try subbing roasted butternut squash in for the sweet potato in our recipe.","Here are more recipes we love: With its natural sweetness, butternut squash also deserves a place at the end of the meal."
b'https://digitalprinting.blogs.xerox.com/2015/11/12/proactive-selling-lead-to-upsell-opportunities/',This company wasn actually a printing company.,"In the e above, the publishing company thought about their clients print requirements before the client did.",Most companies have times when they know they will need print.,"In the e above, the publishing company thought about their clients print requirements before the client did.",Most companies have times when they know they will need print.,A proactive sales call can even persuade a client to order more print than they had planned.
b'https://digitalprinting.blogs.xerox.com/2016/03/08/improving-sales-by-adapting-pitch-to-disc-profile/',One way to understand the mind set of other people is to use the DISC model.,Sales people who use this model will create better relationships with their clients.,The DISC model is an easy way to understand the basics about how another person thinks.,One way to understand the mind set of other people is to use the DISC model.,The DISC model is an easy way to understand the basics about how another person thinks.,They like to get straight to the point.
b'https://smallbusinesssolutions.blogs.xerox.com/2015/06/05/why-mobile-printing-is-invading-the-office-a-look-at-xeroxs-new-android-app/',"We have our mobile devices in the offices but most of the times we have to forward a document to a desktop computer, to print to a printer.",Get desktop features on the go with Xerox #MobilePrint for Android Recently Xerox develop an app for Android that makes it easy to print to our latest Xerox printers and multifunction devices.,"For the KitKat (4.4) version and above, Xerox developed a service plug-in which now makes it much easier to print from your Android smartphone to Xerox printers.","We have our mobile devices in the offices but most of the times we have to forward a document to a desktop computer, to print to a printer.","For the KitKat (4.4) version and above, Xerox developed a service plug-in which now makes it much easier to print from your Android smartphone to Xerox printers.","When many of us think about mobile printing, I bet we think about printing OUTSIDE the office."
b'http://newsroom.lufthansagroup.com/english/more/innovation-technology/press-releases/the-lufthansa-group-invests-in-customization-and-digitalization/s/f2e53d53-317e-43b1-ab86-8c7a0427bee1',"To support this, the Lufthansa Group is making major investments in the areas of product customization and digitalization.",";Between now and 2020, the Lufthansa Group will be investing 500 million euros in the new development and improvement of personalized digital offers alone.",Whether above the clouds or on the ground the Lufthansa Group is reacting to customer preferences with tailor-made digital offers.,Whether above the clouds or on the ground the Lufthansa Group is reacting to customer preferences with tailor-made digital offers.,";Between now and 2020, the Lufthansa Group will be investing 500 million euros in the new development and improvement of personalized digital offers alone.","Heike Birlenbach, Senior Vice President Sales Hub Airlines Lufthansa Group, emphasizes: Standardized processes across all three hub airlines and shared structures reduce comple and make our customers and sales partners the central focus of everything we do."
b'https://enterprisematters.blogs.xerox.com/2012/03/09/impressions-of-rsa-conference-2012-make-security-simple/',That makes him optimistic for security because you can keep all the important information in one place and concentrate the security resources there.,"I think we sort of in the same phase in terms of computer security, but we probably don have 50 years to get it right.","I think the answer is in many of the things discussed at the conference: better information sharing, better training and recruitment of new security professionals, and maybe most important, making security simple.","I think we sort of in the same phase in terms of computer security, but we probably don have 50 years to get it right.",That makes him optimistic for security because you can keep all the important information in one place and concentrate the security resources there.,"I think the answer is in many of the things discussed at the conference: better information sharing, better training and recruitment of new security professionals, and maybe most important, making security simple."
b'https://channelpartner.blogs.xerox.com/2015/09/14/loyal-customers-central-to-every-business-especially-yours/',One of the easiest and least costly ways to hold onto those customers is through the creation of a loyalty program.,Reducing customer loss by just 5% can increase profits by up to 75% Many people will tell you costs more to acquire a new customer than retain an e one.,The Genuine Xerox Rewards program is great way to strengthen your customer loyalty by differentiating your business in a crowded market and discouraging a -price-at-all-costs mentality.,Reducing customer loss by just 5% can increase profits by up to 75% Many people will tell you costs more to acquire a new customer than retain an e one.,The Genuine Xerox Rewards program is great way to strengthen your customer loyalty by differentiating your business in a crowded market and discouraging a -price-at-all-costs mentality.,"In the B2B world, 91% of buyers factor word of mouth into their decision For resellers, the Xerox Supplies Service naturally instills an element of customer loyalty."
b'http://newsroom.lufthansagroup.com/english/press-releases/the-lufthansa-group-invests-in-customization-and-digitalization/s/f2e53d53-317e-43b1-ab86-8c7a0427bee1',"To support this, the Lufthansa Group is making major investments in the areas of product customization and digitalization.",";Between now and 2020, the Lufthansa Group will be investing 500 million euros in the new development and improvement of personalized digital offers alone.",Whether above the clouds or on the ground the Lufthansa Group is reacting to customer preferences with tailor-made digital offers.,Whether above the clouds or on the ground the Lufthansa Group is reacting to customer preferences with tailor-made digital offers.,";Between now and 2020, the Lufthansa Group will be investing 500 million euros in the new development and improvement of personalized digital offers alone.","Heike Birlenbach, Senior Vice President Sales Hub Airlines Lufthansa Group, emphasizes: Standardized processes across all three hub airlines and shared structures reduce comple and make our customers and sales partners the central focus of everything we do."
b'https://channelpartner.blogs.xerox.com/2016/04/14/how-to-keep-the-customers-you-have-and-attract-new-prospects/',"How the Genuine Xerox Rewards loyalty program can lock out your competition While it might not be as delicious as a Caramel Macchiato, it is every bit as effective at cementing the relationship between you and your customers.","It is called the program, and it rewards your customers for purchasing printer supplies from you.","If you are looking for innovative ways to keep the customers you have and attract new prospects, then our combination of Genuine Xerox Rewards, with Xerox Supplies Service gives a Xerox channel partner a rewarding advantage.","It is called the program, and it rewards your customers for purchasing printer supplies from you.","How the Genuine Xerox Rewards loyalty program can lock out your competition While it might not be as delicious as a Caramel Macchiato, it is every bit as effective at cementing the relationship between you and your customers.","If you are looking for innovative ways to keep the customers you have and attract new prospects, then our combination of Genuine Xerox Rewards, with Xerox Supplies Service gives a Xerox channel partner a rewarding advantage."
b'http://searsholdings.com/press-releases/pr/1184',"Parallel's new spring collection, which is now being rolled out to 150 full-line Sears stores and sears.com this spring, offers women modern, wearable, fashion forward styles.",Sears will e the availability of Parallel in time to debut its fall collection at 425 Sears stores.,"In addition to Parallel, Sears' other distinctive women's apparel lines offer shoppers of all ages the ability to e their own individuality: This spring, Sears is e Structure - its new private label collection of men's contemporary fashions - to 460 full-line Sears stores nationwide.","In addition to Parallel, Sears' other distinctive women's apparel lines offer shoppers of all ages the ability to e their own individuality: This spring, Sears is e Structure - its new private label collection of men's contemporary fashions - to 460 full-line Sears stores nationwide.","Parallel's new spring collection, which is now being rolled out to 150 full-line Sears stores and sears.com this spring, offers women modern, wearable, fashion forward styles.","In an e arrangement with BCBG Max Azria Group, Sears, Roebuck and Co. becomes the nation's only retailer to sell Parallel, a sophisticated collection of contemporary apparel."
b'https://news.samsung.com/global/samsung-introduces-an-entirely-new-category-in-refrigeration-as-part-of-kitchen-appliance-lineup-at-2016-ces',"With the new and innovative Family Hub Refrigerator, we are transforming the communal kitchen e for consumers in ways that will re-define how they view and use their refrigerator, said John Herrington, Senior Vice President, General Manager of Home Appliances, Samsung Electronics America.",";The Samsung Family Hub Refrigerator is a sophisticated multi-tasker that reconnects families, organizes groceries and home tasks, and provides entertainment.",";With the kitchen serving as the center of the home and a common gathering spot, the Samsung Family Hub Refrigerator is perfectly suited to entertain friends and family.","With the new and innovative Family Hub Refrigerator, we are transforming the communal kitchen e for consumers in ways that will re-define how they view and use their refrigerator, said John Herrington, Senior Vice President, General Manager of Home Appliances, Samsung Electronics America.",";With the kitchen serving as the center of the home and a common gathering spot, the Samsung Family Hub Refrigerator is perfectly suited to entertain friends and family.",;Samsungs Wi-Fi Slide-in Range with Soft Close Dual Door combines advanced technology with the ultimate in fle functionality to make meal preparation easier and more enjoyable for home cooks.
