X.AUTHID,ILP1,ILP2,ILP3,MMR1,MMR2,MMR3
b'http://investors.technipfmc.com/phoenix.zhtml?ID=2229569&c=254471&p=irol-newsArticle_Print',"Such forward-looking statements involve significant risks, uncertainties and assumptions that could cause actual results to differ materially from our historical e and our present e or projections.","Known material factors that could cause our actual results to differ from those in the forward-looking statements include the Company's ability to successfully manufacture and deliver, and ;'s acceptance of, the subsea systems ordered .","The Company cautions you not to place undue reliance on any forward-looking statements, which speak only as of the date hereof.","Known material factors that could cause our actual results to differ from those in the forward-looking statements include the Company's ability to successfully manufacture and deliver, and ;'s acceptance of, the subsea systems ordered .","The word ""estimated"" and similar e are intended to identify forward-looking statements, which are generally not historical in nature.",", ; -; (NYSE: FTI) announced today that it has received an order from ; (NYSE: STO) for additional subsea equipment for the ; field."
b'https://blog.fitbit.com/what-its-like-to-have-a-beer-with-jens-voigt/',Comments had a beer with you.,But give me a good old Octoberfest beer anytime.,beer is good to Anne?,beer is good to Anne?,But give me a good old Octoberfest beer anytime.,Jens prost ?
b'https://smallbusinesssolutions.blogs.xerox.com/author/jtripton/',By Remaining current with business technology innovations is one way organizations today compete and set themselves apart from the competition.,"makes new business technologies available to small and mid-sized companies (SMBs) thanks to innovations that include cloud-based software solutions, subscription models and mobile technology.",Here are the top five trends in customer service innovation that businesses should focus on to compete on customer care.,"makes new business technologies available to small and mid-sized companies (SMBs) thanks to innovations that include cloud-based software solutions, subscription models and mobile technology.",Here are the top five trends in customer service innovation that businesses should focus on to compete on customer care.,"Once upon a time, of course, only the largest companies could afford to regularly take advantage of new technology offerings, which is why they were always in the best position to reap the rewards of market growth and spending."
b'https://www.citrix.com/blogs/2016/11/28/revisit-virtual-apps-desktops-visit-citrix-cloud-at-aws-reinvent-2016/',;Citrix Cloud customers deploy and manage their trusted Citrix solutions and even third-party apps on ; cloud or infrastructure.,; Citrix Cloud customers leveraging the benefits of AWS to modernize and transform IT delivery include:; Weve seen increasing traction for NetScaler in customer deployments as they migrate to the cloud.,"One of the key differentiators ; Citrix VP of WW Sales and Strategy, Ash Vijayakanthan shares his thoughts on the benefits Citrix Cloud brings for Citrix Service Providers ; NetScaler Management and Analytics from Citrix allows administrators to easily view, automate, and manage all their application infrastructure, as well ;Dont worry, you can unsubscribe at anytime.",;Citrix Cloud customers deploy and manage their trusted Citrix solutions and even third-party apps on ; cloud or infrastructure.,; Citrix Cloud customers leveraging the benefits of AWS to modernize and transform IT delivery include:; Weve seen increasing traction for NetScaler in customer deployments as they migrate to the cloud.,"For e, the new Smart Scale capability found in Citrix Lifecycle Management provides proactive management of underlying AWS resources based on usage."
b'https://www.zebra.com/us/en/about-zebra/newsroom/press-releases/2017/chicago-communications-community-recognizes-zebra-technologies--.html'," (NASDAQ: ZBRA), the market leader in rugged mobile computers, barcode scanners and barcode printers enhanced with software and services to enable real-time enterprise visibility, announced its ; has earned two notable communications industry awards, the Golden Trumpet Award and Skyline Award in the B2B marketing category.","Zebras Intelligent Enterprise campaign was also a finalist in the North America SABRE Awards, the In2 SABRE Awards and the North American E Awards.",; Awards,"Zebras Intelligent Enterprise campaign was also a finalist in the North America SABRE Awards, the In2 SABRE Awards and the North American E Awards."," (NASDAQ: ZBRA), the market leader in rugged mobile computers, barcode scanners and barcode printers enhanced with software and services to enable real-time enterprise visibility, announced its ; has earned two notable communications industry awards, the Golden Trumpet Award and Skyline Award in the B2B marketing category.",Our objective is to share proof points on how Zebra helps our customers become as smart and connected as the world we live in.
b'https://digitalprinting.blogs.xerox.com/author/johnc/',That can be the future for color trade books if more publishers and book printers adopt high-speed production inkjet technology.,By Written by John Conley President of Publishing Corporation Clearly our industry is struggling with the role of its associations.,"We seen the PIA and NAPL talk about By Written By By, John Conley President of Publishing Corporation On Demand Books has announced a partnership with Eastman Kodak Company and ReaderLink to provide photo books through By Written by: Conley President, Publishing and Commercial Print Corporation I am tired of hearing technologist use the Dinosaur analogy when talking about the future of books and Select list(s): jjackson says: jjackson says: Riaz says: Facebook Twitter Google +1 LinkedIn Youtube Select list(s): 2017 Xerox Corporation.","We seen the PIA and NAPL talk about By Written By By, John Conley President of Publishing Corporation On Demand Books has announced a partnership with Eastman Kodak Company and ReaderLink to provide photo books through By Written by: Conley President, Publishing and Commercial Print Corporation I am tired of hearing technologist use the Dinosaur analogy when talking about the future of books and Select list(s): jjackson says: jjackson says: Riaz says: Facebook Twitter Google +1 LinkedIn Youtube Select list(s): 2017 Xerox Corporation.",That can be the future for color trade books if more publishers and book printers adopt high-speed production inkjet technology.,"By In a new twist to the Google-Frommer saga, news broke late last week that Frommer had reacquired their travel guide business committing themselves to printing 40+ new titles beginning this fall, only half of which will be made available in digital format."
b'http://searsholdings.com/press-releases/pr/1745',"Complete, corrected release follows: Sears Names Top 2000 Suppliers as 'Partners In Progress' HOFFMAN ESTATES, Ill., April 11 - Sears, Roebuck and Co. (NYSE: S) honored its top suppliers at the company's annual ""Partners In Progress"" event held at Sears headquarters yesterday.",Sears bestowed the award this year on fewer than 130 suppliers.,"In addition to being named Partners in Progress, the following suppliers were recognized for their e contributions to Sears business success: Awards for Business Group Suppliers of the Year - winners e the highest achievement in partnership with Sears: Awards for Quality - represent the highest quality in merchandise or service: Awards for Innovation - contributed the most meaningful product development or innovation: SOURCE: Sears, Roebuck & Co.","In addition to being named Partners in Progress, the following suppliers were recognized for their e contributions to Sears business success: Awards for Business Group Suppliers of the Year - winners e the highest achievement in partnership with Sears: Awards for Quality - represent the highest quality in merchandise or service: Awards for Innovation - contributed the most meaningful product development or innovation: SOURCE: Sears, Roebuck & Co.","Complete, corrected release follows: Sears Names Top 2000 Suppliers as 'Partners In Progress' HOFFMAN ESTATES, Ill., April 11 - Sears, Roebuck and Co. (NYSE: S) honored its top suppliers at the company's annual ""Partners In Progress"" event held at Sears headquarters yesterday.",Sears bestowed the award this year on fewer than 130 suppliers.
b'http://investors.technipfmc.com/phoenix.zhtml?ID=2229547&c=254471&p=irol-newsArticle_Print',"Such forward-looking statements involve significant risks, uncertainties and assumptions that could cause actual results to differ materially from our historical e and our present e or projections.","Known material factors that could cause our actual results to differ from those in the forward-looking statements include the Company's ability to successfully manufacture and deliver, and ;'s acceptance of, the subsea systems ordered.","The Company undertakes no obligation to publicly update or revise any of its forward-looking statements after the date they are made, whether as a result of new information, future events or otherwise.","Known material factors that could cause our actual results to differ from those in the forward-looking statements include the Company's ability to successfully manufacture and deliver, and ;'s acceptance of, the subsea systems ordered.","The word ""estimated"" and similar e are intended to identify forward-looking statements, which are generally not historical in nature.","The equipment is scheduledfor delivery in 2013.;""; is pleased to have been chosen by ; to provide subsea systems for its continued development of the Who Dat field,"" said ;, ;' Senior Vice President, Subsea Technologies."
b'https://www.citrix.com/blogs/2017/06/07/introducing-sharefile-cloud-storage-for-citrix-service-providers/',"With this simple, powerful value proposition, CSPs are using ShareFile as the catalyst to start their customers on their cloud journey.",";As CSPs manage their customers journey to the cloud, some provided feedback that they would prefer to deliver ShareFile through Citrix-managed cloud storage instead of their own data center.",;The addition of cloud storage will give CSPs the fle to store their customers ShareFile documents in a Citrix-managed Cloud Storage Zone or their own data center.,";As CSPs manage their customers journey to the cloud, some provided feedback that they would prefer to deliver ShareFile through Citrix-managed cloud storage instead of their own data center.",;The addition of cloud storage will give CSPs the fle to store their customers ShareFile documents in a Citrix-managed Cloud Storage Zone or their own data center.,"At the end of 2015, Citrix introduced ShareFile for Citrix Service Providers (CSPs) with the availability of multi-tenancy."
b'http://investors.technipfmc.com/phoenix.zhtml?ID=2229544&c=254471&p=irol-newsArticle_Print',"Such forward-looking statements involve significant risks, uncertainties and assumptions that could cause actual results to differ materially from our historical e and our present e or projections.","Known material factors that could cause our actual results to differ from those in the forward-looking statements include the Company's ability to successfully manufacture and deliver, and ;'s acceptance of, the subsea systems ordered.","The Company cautions you not to place undue reliance on any forward-looking statements, which speak only as of the date hereof.","Known material factors that could cause our actual results to differ from those in the forward-looking statements include the Company's ability to successfully manufacture and deliver, and ;'s acceptance of, the subsea systems ordered.","""We are pleased to provide equipment and systems that will help ; further develop this field.","The word ""estimated"" and similar e are intended to identify forward-looking statements, which are generally not historical in nature."
b'http://performance.ford.com/series/ford-gt/news/articles/wec/2017/09/cota-preview.html',They finished fourth at COTA last year.,"I feeling very positive at the moment as we are heading into a run of tracks that are good for us: COTA, Fuji and Shanghai.",It a long track with lots of fast corners and that is where the Ford GT is very strong.,They finished fourth at COTA last year.,It a long track with lots of fast corners and that is where the Ford GT is very strong.,"I feeling very positive at the moment as we are heading into a run of tracks that are good for us: COTA, Fuji and Shanghai."
b'http://investors.clr.com/phoenix.zhtml?TEXT=aHR0cDovL2FwaS50ZW5rd2l6YXJkLmNvbS9maWxpbmcueG1sP2lwYWdlPTExNDg3MjI2JkRTRVE9MSZTRVE9MiZTUURFU0M9U0VDVElPTl9QQUdFJmV4cD0mc3Vic2lkPTU3&c=197380&p=irol-SECText',"The CLR Bonus Plan provides for the annual payment of cash bonuses, subject to the discretion of the Compensation.",";On March20, 2017, the Compensation Committee approved a change to the used to set the size of the annual bonus pool (the Bonus Pool Factors) from the factors used to set the annual bonus pool in prior years.",The Bonus Pool Factors will remain in effect until by the Compensation Committee.,";On March20, 2017, the Compensation Committee approved a change to the used to set the size of the annual bonus pool (the Bonus Pool Factors) from the factors used to set the annual bonus pool in prior years.","The CLR Bonus Plan provides for the annual payment of cash bonuses, subject to the discretion of the Compensation.",The newly approved factors include: production growth (weighted at 40%); net cash provided operating activities (weighted at 30%); proved developed finding and development cost per barrel of oil equivalent (Boe) (weighted at 15%); and reserve growth (weighted at 15%).
b'https://smallbusinesssolutions.blogs.xerox.com/author/allison-zimmerman/page/4/',By Think you know how many printers you have?,Think again.,In this post we show you 4 easy ways to get those piles off your desk with the help of Xerox ConnectKey Technology.,In this post we show you 4 easy ways to get those piles off your desk with the help of Xerox ConnectKey Technology.,By Think you know how many printers you have?,"Fortunately there is now an easy-to-use option that makes your printing not just secure, but also cost efficient."
b'https://smallbusinesssolutions.blogs.xerox.com/author/jdoyle/',By Over the last few weeks we have talked about the Xerox ConnectKey and the Xerox App Gallery.,"By On March 10, 2016 Xerox announced the launch of 14 ConnectKey-enabled MFPs, each one equipped with ready-to-use apps to speed up paper-dependent business processes and make it easier for users to collaborate and work more effectively.",Xerox and Xerox and Design are trademarks of Xerox Corporation in the United States and/or other countries.,"By On March 10, 2016 Xerox announced the launch of 14 ConnectKey-enabled MFPs, each one equipped with ready-to-use apps to speed up paper-dependent business processes and make it easier for users to collaborate and work more effectively.",Select list(s): pius sumba says: TPM Best Practices says: azimmer says: Facebook Twitter LinkedIn Youtube Select list(s): 2017 Xerox Corporation.,"He's always looking for the ne trends in marketing, and looks forward to your feedback and ideas about what's ne in business and technology."
b'https://smallbusinesssolutions.blogs.xerox.com/2015/12/01/introducing-the-xerox-wireless-print-solutions-adapter/',"The Xerox Wireless Print Solutions Adapter seamlessly connects your Xerox printer or MFP to modern mobile and desktop workflows, regardless of your office environment.","If you have no desire to upgrade your e printer or MFP, but want to integrate wireless and/or mobile printing workflows, the Wireless Print Solutions Adapter is the ideal choice.","Meet the Xerox Wireless Print Solutions Adapter Find additional information, including the product brochure and other resources, at the Wireless Print Solutions Adapter .","Meet the Xerox Wireless Print Solutions Adapter Find additional information, including the product brochure and other resources, at the Wireless Print Solutions Adapter .","Then Again there is also additional to it [] Sep 7, 2017 Aug 28, 2017 Jul 27, 2017 Jun 8, 2017 Apr 17, 2017 Feb 23, 2017 Oct 24, 2016 Oct 17, 2016 Oct 10, 2016 Jan 11, 2016 May 29, 2015 Jan 22, 2015 Oct 22, 2014 Oct 14, 2014 Oct 3, 2014 Sep 9, 2014 Jul 14, 2014 Apr 28, 2014 Feb 8, 2013 Select list(s): pius sumba says: TPM Best Practices says: azimmer says: Facebook Twitter LinkedIn Youtube Select list(s): 2017 Xerox Corporation.",Go wireless without buying a new printer.
b'http://blogs.zebra.com/the-t51-productivity-has-never-looked-this-good'," ; November 28, 2016 at 9:10 AM ;The debate over whether to use consumer devices in retails been going on for years.",";The intuitive Android OS reduces training costs and makes it easy to use key apps and features that include a bright 5-inch HD screen, a 13MP camera, an integrated 1D/2D scanner with a long working range, and Android for work apps.","The TC51 can help your teams:;To make it easier to deploy, maintain and use, The TC51s backed by our Mobility DNA software suite."," ; November 28, 2016 at 9:10 AM ;The debate over whether to use consumer devices in retails been going on for years.",";The intuitive Android OS reduces training costs and makes it easy to use key apps and features that include a bright 5-inch HD screen, a 13MP camera, an integrated 1D/2D scanner with a long working range, and Android for work apps.",;Pictured above is our new TC51.
b'https://www.citrix.com/blogs/2017/04/26/get-rewarded-when-customers-purchase-citrix-essentials-on-the-azure-marketplace/',"With this new joint offering, qualified partners are now eligible to earn money from Citri well as from Microsoft, as long as they meet the Microsoft partner requirements.",You must be a qualifying Citrix partner.,"Connect with him on Twitter ; or on ; Citrix VP of WW Sales and Strategy, Ash Vijayakanthan shares his thoughts on the benefits Citrix Cloud brings for Citrix Service Providers ; Recently, Brad Anderson from Microsoft joined us in Santa Clara for a live event and webcast to address a key ; Five ways ShareFile adds value to Microsoft impact of the Microsoft and Citrix partnership is undeniable with over 230,000 ;Dont worry, you can unsubscribe at anytime.",You must be a qualifying Citrix partner.,"Connect with him on Twitter ; or on ; Citrix VP of WW Sales and Strategy, Ash Vijayakanthan shares his thoughts on the benefits Citrix Cloud brings for Citrix Service Providers ; Recently, Brad Anderson from Microsoft joined us in Santa Clara for a live event and webcast to address a key ; Five ways ShareFile adds value to Microsoft impact of the Microsoft and Citrix partnership is undeniable with over 230,000 ;Dont worry, you can unsubscribe at anytime.",";Give your customer a call within 90 days of their purchase, ask for the subscription ID, ;, and follow a few simple steps."
b'http://investors.technipfmc.com/phoenix.zhtml?ID=2229505&c=254471&p=irol-newsArticle_Print',"Such forward-looking statements involve significant risks, uncertainties and assumptions that could cause actual results to differ materially from our historical e and our present e or projections.","Known material factors that could cause our actual results to differ from those in the forward-looking statements include the Company's ability to successfully deliver, and Pemex's acceptance of, the products ordered.","The Company undertakes no obligation to publicly update or revise any of its forward-looking statements after the date they are made, whether as a result of new information, future events or otherwise.","Known material factors that could cause our actual results to differ from those in the forward-looking statements include the Company's ability to successfully deliver, and Pemex's acceptance of, the products ordered.","The Company undertakes no obligation to publicly update or revise any of its forward-looking statements after the date they are made, whether as a result of new information, future events or otherwise.",", Jan. 24, 2014 - ; (NYSE: FTI) announced today that it has signed a three-year contract with Pemex E and Production for the manufacture and supply of surface wellheads to support its drilling and well maintenance programs in the ;."
b'http://investors.technipfmc.com/phoenix.zhtml?ID=2229527&c=254471&p=irol-newsArticle_Print',"Such forward-looking statements involve significant risks, uncertainties and assumptions that could cause actual results to differ materially from our historical e and our present e or projections.","Known material factors that could cause our actual results to differ from those in the forward-looking statements include the Company's ability to successfully deliver, and ; acceptance of, the subsea products ordered .","The Company undertakes no obligation to publicly update or revise any of its forward-looking statements after the date they are made, whether as a result of new information, future events or otherwise.","Known material factors that could cause our actual results to differ from those in the forward-looking statements include the Company's ability to successfully deliver, and ; acceptance of, the subsea products ordered .",", ; - ; (NYSE: FTI) announced today that it has received an order from ; (NYSE: PBR, PBRA), ; national oil company, for the supply of subsea trees for its pre-salt fields, located offshore ;.","The word ""estimated"" and similar e are intended to identify forward-looking statements, which are generally not historical in nature."
b'http://investors.technipfmc.com/phoenix.zhtml?ID=2229558&c=254471&p=irol-newsArticle_Print',"Such forward-looking statements involve significant risks, uncertainties and assumptions that could cause actual results to differ materially from our historical e and our present e or projections.","Known material factors that could cause our actual results to differ from those in the forward-looking statements include the Company's ability to successfully manufacture and deliver, and ;'s acceptance of, the subsea systems ordered.","The Company undertakes no obligation to publicly update or revise any of its forward-looking statements after the date they are made, whether as a result of new information, future events or otherwise.","Known material factors that could cause our actual results to differ from those in the forward-looking statements include the Company's ability to successfully manufacture and deliver, and ;'s acceptance of, the subsea systems ordered.","The Company undertakes no obligation to publicly update or revise any of its forward-looking statements after the date they are made, whether as a result of new information, future events or otherwise.",", ; -; (NYSE: FTI) announced today that it has received an order from ; (NYSE: ;) for the manufacture and supply of subsea equipment to support water injection in the Thunder Horse field."
b'https://blog.fitbit.com/are-your-workouts-hard-enough-heres-how-to-tell/',I have lost 84lbs over the last 2 years.,;Lost 45 lbs.,I was 205 lbs.,;Lost 45 lbs.,I was 205 lbs.,now I go at 7 mph.
b'https://digitalprinting.blogs.xerox.com/category/applications/cross-media-applications/page/4/',"In fact, we Written by Winter / Marketing Programs Manager , A Xerox Company You may have heard about a study by the Centre for E Consumer Psychology at Bangor University that Written By Joe Schember Marketing, Digital Remember when you were growing up and your parents would tell you that you were special?","Whether you were struggling to Written by Mary Roddy This is an -live blog of the presentation by Steve Hoover, CEO of the legendary PARC lab, on the Future of Communications at Written By Bill Michael Analyst Corporation You know them: hearing, sight, touch, smell, taste.","Inspiration of Written By Tricia Bhattacharya Segment Marketing Manager Corporation As we wrap up In-Plant week, we wanted to highlight the work of another one of our great customers: Written by Gina Testa, Vice President Graphics Communications Business Corporation Coming from Western New York State, the warm, tropical air in Miami Beach this time of year Select list(s): jjackson says: jjackson says: Riaz says: Facebook Twitter Google +1 LinkedIn Youtube Select list(s): 2017 Xerox Corporation.","Inspiration of Written By Tricia Bhattacharya Segment Marketing Manager Corporation As we wrap up In-Plant week, we wanted to highlight the work of another one of our great customers: Written by Gina Testa, Vice President Graphics Communications Business Corporation Coming from Western New York State, the warm, tropical air in Miami Beach this time of year Select list(s): jjackson says: jjackson says: Riaz says: Facebook Twitter Google +1 LinkedIn Youtube Select list(s): 2017 Xerox Corporation.","In fact, we Written by Winter / Marketing Programs Manager , A Xerox Company You may have heard about a study by the Centre for E Consumer Psychology at Bangor University that Written By Joe Schember Marketing, Digital Remember when you were growing up and your parents would tell you that you were special?",See how CopyCat AS of Norway filled their open house event by capturing a 10% response rate and 50% conversation rate with an integrated cross-media campaign.
