X.AUTHID,ILP1,ILP2,ILP3,MMR1,MMR2,MMR3
b'http://blogs.zebra.com/field-service-gets-smart-an-interview-with-zebra-technologies',"The emergence of smart, connected products through the;is shifting the OEM business model from one based on selling individual products to one that sells systems of connected products, sensors, data, and services.","The emergence of the cloud and the IoT type products built into machines today make collecting and analyzing data easier and less e.; Because of the cloud and smart, connected products, data can be handed up without the ball and chain of a network.","For e, Hilton said, if theres a two week delay for service businesses to see insights from data, what good is that?","For e, Hilton said, if theres a two week delay for service businesses to see insights from data, what good is that?","The emergence of the cloud and the IoT type products built into machines today make collecting and analyzing data easier and less e.; Because of the cloud and smart, connected products, data can be handed up without the ball and chain of a network.","Hilton is in charge of manufacturing, transportation, and logistics solutions, which, for Zebra, is all about tracking the visibility of goods, assets, people, processes, and places."
b'https://enterprisematters.blogs.xerox.com/2016/09/07/trusts-seek-control-of-back-office-to-save-nhs-5bn-a-year-by-2020/',"With the ambitious plan to save the NHS a year by 2020, the pressure is on trusts to commit to procurement transformation plans that will drive savings and standardize processes, while improving the patient care e. This is no easy feat, but with an aggressive timeline looming, NHS trusts are taking control where they can.",Xerox is partnering with the NHS in many different areas to make digital transformation happen.,"We will be at 81 at Health and Innovation E 2016 talking about the paper-to-digital journey, as well as showing the hybrid mail service which has delivered remarkable results for Maidstone and Tunbridge Wells NHS Trust.","We will be at 81 at Health and Innovation E 2016 talking about the paper-to-digital journey, as well as showing the hybrid mail service which has delivered remarkable results for Maidstone and Tunbridge Wells NHS Trust.",Xerox is partnering with the NHS in many different areas to make digital transformation happen.,"We helping trusts improve patient safety by digitizing paper medical records, reducing office print volumes and improving document security, as well as printing patient leaflets and forms more efficiently and economically."
b'http://investors.technipfmc.com/phoenix.zhtml?ID=2229883&c=254471&p=irol-newsArticle',These forward-looking statements are based on the Company's current e and beliefs concerning future developments and their potential effect on the Company.,;All of the Company's forward-looking statements involve significant risks and uncertainties (some of which are beyond the Company's control) and assumptions that could cause actual results to differ materially from our historical e and our present e or projections.,"Known material factors that could cause our actual results to differ from those in the forward-looking statements include the Company's ability to enter into additional projects with Statoil, the amount of subsea equipment actually ordered pursuant to the agreement and the Company's ability to successfully manufacture and deliver, and Statoil's acceptance of, the subsea systems ordered.","Known material factors that could cause our actual results to differ from those in the forward-looking statements include the Company's ability to enter into additional projects with Statoil, the amount of subsea equipment actually ordered pursuant to the agreement and the Company's ability to successfully manufacture and deliver, and Statoil's acceptance of, the subsea systems ordered.",These forward-looking statements are based on the Company's current e and beliefs concerning future developments and their potential effect on the Company.,"Deliveries are e to occur throughout 2013.;""Fram H-Nord is the si fast-track project that we have been awarded from Statoil in the past two years,"" said ;, FMC's Senior Vice President, Subsea Technologies."
b'http://newsroom.lufthansagroup.com/english/more/innovation-technology/locating-turbulence/s/006e01b2-0895-4b68-bb16-bb8e04867f65',;But Lufthansa pilots may soon have more accurate information about the location and strength of turbulence.,The eddy dissipation rate (EDR) measurement method is used on the electronic flight bag (EFB) in the cockpit to check the forecast.,"Together with Karssemeijer, Matz carried out successful tests of the new system on two flights to Frankfurt.",;But Lufthansa pilots may soon have more accurate information about the location and strength of turbulence.,The eddy dissipation rate (EDR) measurement method is used on the electronic flight bag (EFB) in the cockpit to check the forecast.,"Together with Karssemeijer, Matz carried out successful tests of the new system on two flights to Frankfurt."
b'https://connect.blogs.xerox.com/2016/03/10/5-essentials-for-the-office-of-the-future/',"Given that the office isn a physical location anymore, both software and hardware must be configured to be used effectively and efficiently by a growing virtual, mobile and contract workforce.","Whether you are an enterprise or an SMB, here are the must-haves for your technology.","5 must-haves for your technology, whether you are enterprise or SMB.","Whether you are an enterprise or an SMB, here are the must-haves for your technology.","Given that the office isn a physical location anymore, both software and hardware must be configured to be used effectively and efficiently by a growing virtual, mobile and contract workforce.",What new technologies are helping you be more productive at work?
b'https://www.lufthansagroup.com/en/responsibility/corporate-citizenship/social-commitment.html',;help alliance is the charity of the Lufthansa Group.,"Together with its staff charity Help Alliance, the Lufthansa Group not only supports acute refugee assistance but is also committed to projects in Germany integrating young migrants in the long term with the aid of a carefully thought-through strategy.",news from the Lufthansa Group,;help alliance is the charity of the Lufthansa Group.,"Together with its staff charity Help Alliance, the Lufthansa Group not only supports acute refugee assistance but is also committed to projects in Germany integrating young migrants in the long term with the aid of a carefully thought-through strategy.",news from the Lufthansa Group
b'http://newsroom.lufthansagroup.com/english/more/innovation-technology/press-releases/dimensions-of-digitization/s/0afe008d-0c7a-4f66-b97d-1e26617d5250',And this is why we here at the Lufthansa Group are using digitalization to make our business even better and more efficient.,"On January 10th, at the Digital Aviation Forum in Frankfurt, we presented the digital portfolio of our group to decision makers, the media, and our customers.",;The ne level of digitalization will deal with the question of how to use new digital opportunities to increase the satisfaction and loyalty of our customers with products and services that are tailored to their needs.,And this is why we here at the Lufthansa Group are using digitalization to make our business even better and more efficient.,"On January 10th, at the Digital Aviation Forum in Frankfurt, we presented the digital portfolio of our group to decision makers, the media, and our customers.",;The ne level of digitalization will deal with the question of how to use new digital opportunities to increase the satisfaction and loyalty of our customers with products and services that are tailored to their needs.
b'https://connect.blogs.xerox.com/2015/05/15/the-brand-that-transformed-an-industry/',It is the emotion customers feel when interacting with your brand.,"Once you have transformed an industry with your brand, e in new verticals.",How can your brand apply itself to other industries and provide even more e for your customers?,It is the emotion customers feel when interacting with your brand.,"Once you have transformed an industry with your brand, e in new verticals.","Bayle-Labour e, are two types of feedback: the organic and the organized."
b'http://www.wholefoodsmarket.com/blog/whole-story/local-producer-epicurean-butter',"Compound butter, also known as butter, is unsalted and blended with a variety of seasonings.",Give it a dab of Black Truffle Butter.,Some Orange Honey Butter should do the trick.,"Compound butter, also known as butter, is unsalted and blended with a variety of seasonings.",Give it a dab of Black Truffle Butter.,"| | | | | ""Whole Foods Market"" is a registered trademark of Whole Foods Market IP, L.P. We have sent a confirmation email to {* emailAddressData *}."
b'http://blogs.zebra.com/building-relationships-through-data-connectivity',"Well, as with all the best elements of retail, it has to start with the customer:;Guest Wi-Fi is the starting point, helping connect customers to key store data, allowing them to find the information they need to make an informed decision:;Understandably, many retailers hesitate to make it easier for customers to compare prices, the ; even allows shoppers to take a photo of an item in store and see similar products available via Amazon.",";For this reason, we are seeing an upsurge in retailers adopting in-store customer shopping apps incorporating information, store maps and offers.",";These location-based technologies help shoppers find the right product and give retailers the insight to continually improve the customer e.;And making the customers journey easier, is the key to creating the e interactions and customer engagement required to build a relationship.","Well, as with all the best elements of retail, it has to start with the customer:;Guest Wi-Fi is the starting point, helping connect customers to key store data, allowing them to find the information they need to make an informed decision:;Understandably, many retailers hesitate to make it easier for customers to compare prices, the ; even allows shoppers to take a photo of an item in store and see similar products available via Amazon.",";These location-based technologies help shoppers find the right product and give retailers the insight to continually improve the customer e.;And making the customers journey easier, is the key to creating the e interactions and customer engagement required to build a relationship.",";For this reason, we are seeing an upsurge in retailers adopting in-store customer shopping apps incorporating information, store maps and offers."
b'http://newsroom.lufthansagroup.com/english/more/innovation-technology/press-releases/locating-turbulence/s/006e01b2-0895-4b68-bb16-bb8e04867f65',;But Lufthansa pilots may soon have more accurate information about the location and strength of turbulence.,The eddy dissipation rate (EDR) measurement method is used on the electronic flight bag (EFB) in the cockpit to check the forecast.,"Pilots will be able to move to a different altitude or at least warn flight attendants and passengers in good time, according to Karssemeijer.",;But Lufthansa pilots may soon have more accurate information about the location and strength of turbulence.,The eddy dissipation rate (EDR) measurement method is used on the electronic flight bag (EFB) in the cockpit to check the forecast.,"Together with Karssemeijer, Matz carried out successful tests of the new system on two flights to Frankfurt."
b'http://blogs.zebra.com/amazon-dash-fad-or-future',";As we move into the future, theres no doubt retailers will look to offer a frictionless shopping e of their own, and further simplify the way we buy in-store.",";Its really no surprise retailers are looking to achieve a frictionless shopping e. With common inconveniences removed, the act of buying will be simplified even further and this intern should drive repeat custom.",Now thats a frictionless shopping e!,";As we move into the future, theres no doubt retailers will look to offer a frictionless shopping e of their own, and further simplify the way we buy in-store.",Now thats a frictionless shopping e!,Amazons new Dash buttons can sort your needs at quite literally the touch of a button.
b'http://investors.technipfmc.com/phoenix.zhtml?ID=2229880&c=254471&p=irol-newsArticle_Print',These forward-looking statements are based on the Company's current e and beliefs concerning future developments and their potential effect on the Company.,;All of the Company's forward-looking statements involve significant risks and uncertainties (some of which are beyond the Company's control) and assumptions that could cause actual results to differ materially from our historical e and our present e or projections.,"Known material factors that could cause our actual results to differ from those in the forward-looking statements include the Company's ability to enter into additional projects with Petrobras, the amount of subsea equipment actually ordered pursuant to the agreement and the Company's ability to successfully manufacture and deliver, and Petrobras' acceptance of, the subsea systems ordered.","Known material factors that could cause our actual results to differ from those in the forward-looking statements include the Company's ability to enter into additional projects with Petrobras, the amount of subsea equipment actually ordered pursuant to the agreement and the Company's ability to successfully manufacture and deliver, and Petrobras' acceptance of, the subsea systems ordered.","The Company undertakes no obligation to publicly update or revise any of its forward-looking statements after the date they are made, whether as a result of new information, future events or otherwise.",";FMC's total scope of supply could include the delivery of up to 130 subsea trees, subsea multiplex controls and related tools and equipment."
b'https://connect.blogs.xerox.com/2014/12/22/the-art-of-the-first-impression/',"Whether you are moving into a new assignment, relocating for convenience, or simply taking on a new customer, a good first impression will start any new relationship off on the right foot.","I spent 30 years servicing Xerox equipment in the field , had several reassignments, a relocation, and come in contact with countless new customers.",we get so caught up in letting customers know what we have to offer that we miss out completely on what they want.,"Whether you are moving into a new assignment, relocating for convenience, or simply taking on a new customer, a good first impression will start any new relationship off on the right foot.",we get so caught up in letting customers know what we have to offer that we miss out completely on what they want.,"I spent 30 years servicing Xerox equipment in the field , had several reassignments, a relocation, and come in contact with countless new customers."
b'https://connect.blogs.xerox.com/2017/08/11/set-the-page-free-in-the-modern-workplace-to-automate-or-not/',Randy Dazo is the group director for Office Document Technology at .,"Technology enables us to receive more messages, quicker than before.","technology changes how we think and what we think about, Dazo said.",Randy Dazo is the group director for Office Document Technology at .,"Technology enables us to receive more messages, quicker than before.","technology changes how we think and what we think about, Dazo said."
b'http://newsroom.lufthansagroup.com/english/press-releases/locating-turbulence/s/006e01b2-0895-4b68-bb16-bb8e04867f65',;But Lufthansa pilots may soon have more accurate information about the location and strength of turbulence.,The eddy dissipation rate (EDR) measurement method is used on the electronic flight bag (EFB) in the cockpit to check the forecast.,"Pilots will be able to move to a different altitude or at least warn flight attendants and passengers in good time, according to Karssemeijer.",;But Lufthansa pilots may soon have more accurate information about the location and strength of turbulence.,The eddy dissipation rate (EDR) measurement method is used on the electronic flight bag (EFB) in the cockpit to check the forecast.,"Together with Karssemeijer, Matz carried out successful tests of the new system on two flights to Frankfurt."
b'https://www.news.xerox.com/news/Xerox-WorkCentre-3335-3345-Multifunction-Printers-and-Phaser-3330',See why your business can count on the new Xerox WorkCentre 3335/3345 Multifunction Printers and Xerox Phaser 3330.,The new Xerox WorkCentre 3335/3345 Multifunction Printers and Xerox Phaser 3330 help even the smallest offices stay productive and uncover easier and simplified ways to work.,The new Xerox WorkCentre 3335/3345 Multifunction Printers and Xerox Phaser 3330 help even the smallest offices stay productive and uncover easier and simplified ways to work.,The new Xerox WorkCentre 3335/3345 Multifunction Printers and Xerox Phaser 3330 help even the smallest offices stay productive and uncover easier and simplified ways to work.,The new Xerox WorkCentre 3335/3345 Multifunction Printers and Xerox Phaser 3330 help even the smallest offices stay productive and uncover easier and simplified ways to work.,"On January 29, 2016, Xerox announced its plans to separate into two independent, publicly traded companies Xerox Corporation, which will be comprised of the company Document Technology and Document Outsourcing businesses, and Conduent Incorporated, a business process services company."
b'http://searsholdings.com/press-releases/pr/531',"HOFFMAN ESTATES, Ill., March 1, 2011 - For the 28th year, Kmart is collaborating with the March of Dimes to raise funds to help improve the health of babies by preventing birth defects, premature birth and infant mortality.","Kmart customers can contribute to the annual March of Dimes campaign by making a donation at any Kmart store from now until May 28, 2011.","With chapters nationwide and its premier event, March for Babies, the March of Dimes works to improve the health of babies by preventing birth defects, premature birth and infant mortality.","HOFFMAN ESTATES, Ill., March 1, 2011 - For the 28th year, Kmart is collaborating with the March of Dimes to raise funds to help improve the health of babies by preventing birth defects, premature birth and infant mortality.","Kmart customers can contribute to the annual March of Dimes campaign by making a donation at any Kmart store from now until May 28, 2011.","With chapters nationwide and its premier event, March for Babies, the March of Dimes works to improve the health of babies by preventing birth defects, premature birth and infant mortality."
b'http://searsholdings.com/press-releases/pr/1997',"Sears also announced a bonus for shoppers planning ahead for and Black Friday: For the first time, Sears will release its highly anticipated Black Friday ad first to Shop Your Way members via the Sears mobile app.","Sears, Roebuck and Co., a wholly owned subsidiary of Sears Holdings Corporation (NASDAQ: SHLD), is a leading integrated retailer providing merchandise and related services and part of Shop Your Way, a social shopping e where members have the ability to earn points and receive benefits across a wide variety of physical and digital formats through ., Roebuck offers its wide range of home merchandise, apparel and automotive products and services through Sears-branded and affiliated full-line and specialty retail stores in the United States., Roebuck also offers a variety of merchandise and services through sears.com, landsend.com and specialty catalogs.","For more information, visit the Sears, Roebuck website at the Sears Holdings Corporation website at .","Sears, Roebuck and Co., a wholly owned subsidiary of Sears Holdings Corporation (NASDAQ: SHLD), is a leading integrated retailer providing merchandise and related services and part of Shop Your Way, a social shopping e where members have the ability to earn points and receive benefits across a wide variety of physical and digital formats through ., Roebuck offers its wide range of home merchandise, apparel and automotive products and services through Sears-branded and affiliated full-line and specialty retail stores in the United States., Roebuck also offers a variety of merchandise and services through sears.com, landsend.com and specialty catalogs.","Sears also introduced limited-edition products for the holiday season that give back to Heroes at Home with every purchase, including: ""Taking care of our veterans is paramount, especially their safety, health and mobility,"" said , President and CEO of Rebuilding Together.","Starting , members can donate to Rebuilding Together, a leading national nonprofit in safe and healthy housing, when they check out at any Sears store or via a link at ."
b'http://www.wholefoodsmarket.com/blog/whole-story/frans-chocolates',"And of course, you can find Fran Chocolates in Whole Foods Market stores throughout the US.","Since Fran marks 30 years of producing one-of-a-kind sweets on June 1 of this year, I took a tour of their production kitchens with CEO Andrina Bigelow, Fran daughter, to learn just what makes them so special.","Hue (shown here) has been part of Fran for 19 years, and in the early years it was just Fran and Hue tying the ribbons on each box.","And of course, you can find Fran Chocolates in Whole Foods Market stores throughout the US.","Since Fran marks 30 years of producing one-of-a-kind sweets on June 1 of this year, I took a tour of their production kitchens with CEO Andrina Bigelow, Fran daughter, to learn just what makes them so special.","Hue (shown here) has been part of Fran for 19 years, and in the early years it was just Fran and Hue tying the ribbons on each box."
b'http://investors.citrix.com/releasedetail.cfm?releaseid=649322'," Citrix Systems, Inc. (NASDAQ: CTXS) today announced Citrix XenServer has been awarded the Members Choice Award for Virtualization by The Code Project, one of the worlds largest online developer communities.",";#; and XenServer are trademarks of Citrix Systems, Inc. and/or one or more of its subsidiaries, and may be registered in the U.S. Patent and Trademark Office and in other countries.","; | ;Copyright 2017 Citrix Systems, Inc"," Citrix Systems, Inc. (NASDAQ: CTXS) today announced Citrix XenServer has been awarded the Members Choice Award for Virtualization by The Code Project, one of the worlds largest online developer communities.","Gartner does not endorse any vendor, product or service depicted in the Magic Quadrant, and does not advise technology users to select only those vendors placed in the Leaders quadrant.",";#; and XenServer are trademarks of Citrix Systems, Inc. and/or one or more of its subsidiaries, and may be registered in the U.S. Patent and Trademark Office and in other countries."
b'https://blog.fitbit.com/spreading-the-fitbit-love-to-the-workplace/',"We believe that small changes can add up to big results, and we created Fitbits corporate wellness program to bring the benefits of Fitbit trackers to the workplace, because, as a surprise to no one: healthy employees are happier and more productive!",The company equipped their employees with Fitbit trackers and created a Fitbit community group for them.,;Hack Reactors recent health initiative is to give all of our employees Fitbit trackers.,;Hack Reactors recent health initiative is to give all of our employees Fitbit trackers.,"We believe that small changes can add up to big results, and we created Fitbits corporate wellness program to bring the benefits of Fitbit trackers to the workplace, because, as a surprise to no one: healthy employees are happier and more productive!","People started walking to work and almost everyone admitted to walking in circles around their house late at night to get to their 10,000 step goal each day,says Maggie."
b'https://www.citrix.com/blogs/2017/07/25/are-you-struggling-as-a-mid-sized-company-it-manager/',This solution allows you to maintain all of your storage/data and workloads onsite but also take advantage of Citrix Cloud for active management of your IT solutions.,"If you are already an e in Citrix solutions but just need a way to run your workloads in the cloud, Citrix has partnered with Microsoft to give you the best cloud infrastructure solution for XenApp and XenDesktop.","In addition, you get the benefits of both Citrix and Microsoft Cloud solutions in a single bundle.","If you are already an e in Citrix solutions but just need a way to run your workloads in the cloud, Citrix has partnered with Microsoft to give you the best cloud infrastructure solution for XenApp and XenDesktop.",This solution allows you to maintain all of your storage/data and workloads onsite but also take advantage of Citrix Cloud for active management of your IT solutions.,"This is the Citrix Workspace Appliance program, which is a self-contained, on-premises solution complete with best-in-class HCI appliances from Citrix partners that are connected to Citrix Cloud."
